{
  "schema_version": "1.0.0",
  "request_id": "req-design-provider-001",
  "timestamp": "2026-07-25T12:03:00Z",
  "component": "evo-intelligence-fabric",
  "phase": "design",
  "action": "architecture.external-provider-dependency",
  "actor": {
    "kind": "human",
    "id": "architecture-reviewer"
  },
  "resource": {
    "kind": "architecture-proposal",
    "id": "proposal-001"
  },
  "context": {
    "execution_target": "external_service",
    "data_sensitivity": "internal",
    "external_provider": "single-provider",
    "network_egress": true,
    "agency": "assisted",
    "explicit_approval": "not_applicable",
    "audit_ready": "confirmed",
    "bounded_scope": "not_applicable",
    "interruptible": "not_applicable",
    "reversible": "confirmed",
    "provider_portability": "absent"
  }
}
