{
  "schema_version": "1.0.0",
  "request_id": "req-external-restricted-001",
  "timestamp": "2026-07-25T12:01:00Z",
  "component": "saturn-control",
  "phase": "runtime",
  "action": "model.infer.external",
  "actor": {
    "kind": "human",
    "id": "local-user"
  },
  "resource": {
    "kind": "inference-job",
    "id": "job-002"
  },
  "context": {
    "execution_target": "external_service",
    "data_sensitivity": "restricted",
    "external_provider": "example-provider",
    "network_egress": true,
    "agency": "human_initiated",
    "explicit_approval": "confirmed",
    "audit_ready": "confirmed",
    "bounded_scope": "not_applicable",
    "interruptible": "not_applicable",
    "reversible": "not_applicable",
    "provider_portability": "confirmed"
  }
}
